{
  "schema_version": 1,
  "dataset_id": "ram",
  "market": "GB",
  "currency": "GBP",
  "policy_id": "sf-retailer-comparison-roster-v1",
  "policy_sha256": "4e47caed5b56e7bdcf219d6e9e66394601e29df16c24a405f33ea7f1df8b9e27",
  "absence_label": "No qualifying released observation",
  "spotlight_labels": [
    "Lower retained observation",
    "Middle retained observation",
    "Higher retained observation"
  ],
  "retailers": [
    {
      "retailer_id": "awd-it",
      "display_name": "AWD-IT"
    },
    {
      "retailer_id": "box-uk",
      "display_name": "Box.co.uk"
    },
    {
      "retailer_id": "ccl",
      "display_name": "CCL"
    },
    {
      "retailer_id": "currys",
      "display_name": "Currys"
    },
    {
      "retailer_id": "kingston-memory-shop",
      "display_name": "KingstonMemoryShop"
    },
    {
      "retailer_id": "novatech",
      "display_name": "Novatech"
    },
    {
      "retailer_id": "overclockers-uk",
      "display_name": "Overclockers UK"
    },
    {
      "retailer_id": "scan-computers",
      "display_name": "Scan"
    }
  ]
}
